{
  "manifest_version": "langchao.acceptance-manifest.v1",
  "manifest_id": "langchao-prelaunch-acceptance-20261002",
  "generated_at": "2026-10-02T02:30:00+08:00",
  "purpose": "Freeze T01-T32 acceptance methods before execution; this document records no passing result and authorizes no deployment.",
  "release_decision": "hold_not_authorized",
  "baseline": {
    "branch": "feat/langchao-decision-engine",
    "commit": "32bd8a2fbad167c3f6c66d99e704268208d5fed5",
    "database_schema_version": 20,
    "design_document": "runtime/docs/我即浪潮_决策模块完整设计与三份核心契约_v1.0.md",
    "review_standard": "attachment/我即浪潮_马克思主义哲学视角_设计与收益目的审查要求_v1.0.md"
  },
  "hashes": {
    "commit": {
      "algorithm": "sha256",
      "canonicalization": "git_object_id",
      "artifact": "git:HEAD",
      "value": "32bd8a2fbad167c3f6c66d99e704268208d5fed5"
    },
    "acceptance_schema": {
      "algorithm": "sha256",
      "canonicalization": "raw_bytes",
      "artifact": "runtime/audit/langchao_acceptance_manifest_v1.schema.json",
      "value": "07d75f54319c44b278318ee25e3295176b609e7e288cf6a349c6a0b31163b241"
    },
    "database_schema": {
      "algorithm": "sha256",
      "canonicalization": "raw_bytes",
      "artifact": "ordered-concatenation:runtime/src/companion_runtime/user_model_v2_schema.py,runtime/src/companion_runtime/langchao_schema.py,runtime/src/companion_runtime/langchao_outcome_schema.py,runtime/src/companion_runtime/langchao_state_schema.py,runtime/src/companion_runtime/langchao_authority_schema.py,runtime/src/companion_runtime/langchao_shadow_schema.py,runtime/src/companion_runtime/langchao_social_schema.py,runtime/src/companion_runtime/live_dispatch_schema.py,runtime/src/companion_runtime/langchao_live_schema.py,runtime/src/companion_runtime/langchao_live_fk_schema.py",
      "value": "43c003cbc64bcaeab1978e120ed1d0d0c47bf8bc1c7712bb64abe2df44055958"
    },
    "configuration": {
      "algorithm": "sha256",
      "canonicalization": "canonical_json_rfc8785_subset",
      "artifact": "global_protocol.frozen_configuration",
      "value": "514d111b0895d367072b7af3c038f6d4de70c83654229f85036dc31fcf26b559"
    },
    "review_standard": {
      "algorithm": "sha256",
      "canonicalization": "raw_bytes",
      "artifact": "attachment/我即浪潮_马克思主义哲学视角_设计与收益目的审查要求_v1.0.md",
      "value": "ab18f75fe9d8b6d2ace91e8736a7a5dd2b01b9144bae99a3538f58386dce4161"
    }
  },
  "stages": [
    "design_review",
    "isolated_unit",
    "isolated_postgres",
    "shadow",
    "authorized_canary",
    "authorized_effect_study"
  ],
  "evidence_classes": {
    "D": "versioned_design_basis",
    "C": "source_and_call_chain_read_in_this_review",
    "T": "isolated_execution_with_preserved_inputs_and_results",
    "R": "authorized_real_runtime_evidence",
    "S": "human_semantic_review_with_rubric_and_disagreement_record",
    "I": "inference_with_explicit_premises"
  },
  "status_policy": {
    "initial_allowed": [
      "planned",
      "not_applicable"
    ],
    "execution_allowed": [
      "planned",
      "running",
      "passed_limited",
      "failed",
      "evidence_insufficient",
      "not_applicable",
      "blocked"
    ],
    "passing_status_requires_separate_result_artifact": true
  },
  "global_protocol": {
    "frozen_configuration": {
      "langchao_parameters": {
        "parameter_version": "langchao.parameters.v1",
        "leak": 0.2,
        "competition_gain": 0.0,
        "decision_threshold": 0.99,
        "time_scale_seconds": 10.0,
        "max_step_seconds": 0.5,
        "crossing_tolerance": 1e-07,
        "tie_tolerance": 1e-06
      },
      "decision_budget_seconds": 300.0,
      "initial_readiness": 0.0,
      "tie_order": "fixture_declared_total_order",
      "permission_version": "fixture.permission.v1",
      "boundary_version": "fixture.boundary.v1",
      "candidate_supply": "fixture_frozen",
      "semantic_generation": "fixture_frozen_or_preserved_for_review"
    },
    "denominator_policy": "Every rate reports numerator, denominator unit, exclusions, missingness and coverage. Zero matching exposures is no_evaluable_exposure, never 0% violation.",
    "tolerance_policy": "Hard safety invariants are zero-tolerance per sample; numerical comparisons use each test absolute/relative tolerances and may not average away violations.",
    "seed_policy": "The pure Langchao kernel has no random source. Seeds are mandatory only for Runtime-v2 hazard, generators, sampling or multi-seed comparisons and must be recorded before execution.",
    "timeout_policy": "Timeout is not a pass or defer: fail closed, preserve partial evidence, and report the exact unfinished stage.",
    "privacy": {
      "data_class": "synthetic",
      "synthetic_only": true,
      "direct_identifiers": "prohibited",
      "retention_days": 30,
      "storage": "encrypted_local_review_artifacts",
      "redaction": "replace all user, channel, message and external account identifiers before preservation",
      "deletion_propagation": "delete dependent fixture, review packet and derived evidence when a source deletion applies"
    },
    "hard_blockers": [
      "unauthorized_or_wrong_scope_send",
      "cross_user_private_material_reference",
      "fabricated_execution_artifact_or_feedback",
      "duplicate_settlement_of_one_actual_outcome",
      "dispatch_after_permission_revocation",
      "sent_attempt_restored_retryable_by_ack_routing_error",
      "live_commit_dispatch_claim_mismatch",
      "recovery_requires_user_soothing",
      "execution_after_critical_source_invalidation"
    ]
  },
  "tests": [
    {
      "id": "T01",
      "title": "事实来源与语义真实性",
      "requirement_families": [
        "MAT"
      ],
      "verification_kind": "mixed",
      "applicable_stage": [
        "design_review",
        "isolated_unit"
      ],
      "fixture": {
        "id": "fixture:t01:v1",
        "kind": "canonical_json",
        "canonical_input": {
          "fixture_version": "langchao.fixture.v1",
          "test_id": "T01",
          "title": "事实来源与语义真实性",
          "as_of": "2026-10-02T00:00:00Z",
          "scope": "synthetic:acceptance:user-001",
          "database_state": "empty_then_fixture_load",
          "configuration": {
            "langchao_parameters": {
              "parameter_version": "langchao.parameters.v1",
              "leak": 0.2,
              "competition_gain": 0.0,
              "decision_threshold": 0.99,
              "time_scale_seconds": 10.0,
              "max_step_seconds": 0.5,
              "crossing_tolerance": 1e-07,
              "tie_tolerance": 1e-06
            },
            "decision_budget_seconds": 300.0,
            "initial_readiness": 0.0,
            "tie_order": "fixture_declared_total_order",
            "permission_version": "fixture.permission.v1",
            "boundary_version": "fixture.boundary.v1",
            "candidate_supply": "fixture_frozen",
            "semantic_generation": "fixture_frozen_or_preserved_for_review"
          },
          "timeline_seconds": [
            0,
            30,
            60,
            120,
            300
          ],
          "candidate_ids": [
            "external:expression",
            "internal:rest"
          ],
          "permission": "fixture.permission.v1",
          "boundary": "fixture.boundary.v1"
        },
        "sha256": "ef27482cd92acfd9492f8af1f855e6f2668b7a18b5e42eb57902c52faf46733b"
      },
      "oracle": {
        "mechanical_assertions": [
          "每项事实引用同作用域可追溯来源",
          "未知或推断不得标成已确认事实"
        ],
        "allowed_outcomes": [
          "grounded",
          "unknown_preserved",
          "rejected_unverifiable"
        ],
        "semantic_review": {
          "rubric": [
            "区分可观察事实、推断与价值判断",
            "不得用禁词表或单一judge替代语义判断",
            "保存原文、独立判断、理由与分歧"
          ],
          "reviewers": 2,
          "adjudication": "两名独立评审；分歧由第三名在不查看多数结论前裁决",
          "minimum_agreement": 0.8
        }
      },
      "evidence": {
        "required_classes": [
          "D",
          "C",
          "T",
          "S"
        ],
        "minimum_level": "isolated_execution",
        "artifacts": [
          "runtime/audit/evidence/T01/input.json",
          "runtime/audit/evidence/T01/result.json"
        ]
      },
      "positive_control": {
        "fixture_delta": {
          "source_ref": "valid_same_scope_event"
        },
        "expected_capability": "有真实来源的普通候选被接受"
      },
      "status": "planned",
      "blocker": null,
      "denominator": {
        "unit": "semantic_item",
        "planned_count": 24,
        "exclusions": [
          "fixture_load_failure",
          "predeclared_environment_unavailable"
        ],
        "zero_exposure_label": "no_evaluable_exposure"
      },
      "tolerance": {
        "absolute": null,
        "relative": null,
        "max_steps": 1000,
        "zero_tolerance_invariants": [
          "unauthorized_send",
          "cross_scope_private_reference",
          "duplicate_settlement",
          "fabricated_execution_or_feedback"
        ]
      },
      "seed": {
        "required": false,
        "values": [],
        "reason": "pure deterministic path; a seed would falsely imply randomness"
      },
      "timeout": {
        "per_case_seconds": 60,
        "suite_seconds": 3600,
        "on_timeout": "fail_closed_and_preserve_partial_evidence"
      },
      "privacy": {
        "data_class": "synthetic",
        "synthetic_only": true,
        "direct_identifiers": "prohibited",
        "retention_days": 30,
        "storage": "encrypted_local_review_artifacts",
        "redaction": "replace all user, channel, message and external account identifiers before preservation",
        "deletion_propagation": "delete dependent fixture, review packet and derived evidence when a source deletion applies"
      },
      "canonical_requirement_id": "LC-MAT-01",
      "legacy_aliases": [
        {
          "namespace": "acceptance-manifest-20261002",